{
  "ablations": [
    {
      "allowedTools": [
        "session-abort",
        "session-apply",
        "session-begin",
        "session-stage",
        "session-status",
        "session-test"
      ],
      "contentIdentitySha256": "8cf3bdaa691ccf29bf83e6016d3dd21cb2064b5b8be84e8c52a4afa8f7c46d9e",
      "contrast": {
        "baselineId": "one-attempt",
        "dimension": "repair"
      },
      "features": {
        "attempts": 2,
        "context": "retrieval-seed",
        "diagnostics": "structured-catalog-v0.1",
        "editing": "semantic-transaction-v0.1",
        "grammar": "gc-agent-v0.3-constraint",
        "repairs": 1,
        "retrieval": "integer-lexical-v0.1"
      },
      "id": "bounded-repair",
      "ordinal": 8,
      "purpose": "Full fixed agent with one deterministic, diagnostic-bound repair opportunity."
    },
    {
      "allowedTools": [],
      "contentIdentitySha256": "e3a62167a35cc80e51b61249f4d6cd80e6b2b559b8cee784c3fa7e64b378308a",
      "contrast": {
        "baselineId": null,
        "dimension": "reference-control"
      },
      "features": {
        "attempts": 1,
        "context": "core-card-only",
        "diagnostics": "terminal-code-only",
        "editing": "artifact-response",
        "grammar": "production-acceptance-only",
        "repairs": 0,
        "retrieval": "disabled"
      },
      "id": "core-card-only",
      "ordinal": 1,
      "purpose": "Minimal acquisition control exposing only the compact core language card."
    },
    {
      "allowedTools": [],
      "contentIdentitySha256": "f818a53de568310da607eeacb262d9319661684253b374936449974515d69af6",
      "contrast": {
        "baselineId": "retrieval",
        "dimension": "diagnostics"
      },
      "features": {
        "attempts": 1,
        "context": "retrieval-seed",
        "diagnostics": "structured-catalog-v0.1",
        "editing": "artifact-response",
        "grammar": "production-acceptance-only",
        "repairs": 0,
        "retrieval": "integer-lexical-v0.1"
      },
      "id": "diagnostics",
      "ordinal": 4,
      "purpose": "Retrieval control plus the structured diagnostic catalog and no other agent aid."
    },
    {
      "allowedTools": [],
      "contentIdentitySha256": "33d1b9134421a5deacde16aaafe18ca9f7b1e0097c054beb38b6281709557d2b",
      "contrast": {
        "baselineId": "core-card-only",
        "dimension": "context-breadth"
      },
      "features": {
        "attempts": 1,
        "context": "fixed-context",
        "diagnostics": "terminal-code-only",
        "editing": "artifact-response",
        "grammar": "production-acceptance-only",
        "repairs": 0,
        "retrieval": "disabled"
      },
      "id": "fixed-context",
      "ordinal": 2,
      "purpose": "Deterministic full context pack without task-conditioned document retrieval."
    },
    {
      "allowedTools": [],
      "contentIdentitySha256": "e1addced3909379e3f076fe0769d746af07e647e0a4ba83c7c7f6ffe176813e6",
      "contrast": {
        "baselineId": "retrieval",
        "dimension": "grammar"
      },
      "features": {
        "attempts": 1,
        "context": "retrieval-seed",
        "diagnostics": "terminal-code-only",
        "editing": "artifact-response",
        "grammar": "gc-agent-v0.3-constraint",
        "repairs": 0,
        "retrieval": "integer-lexical-v0.1"
      },
      "id": "grammar-constraint",
      "ordinal": 6,
      "purpose": "Retrieval control plus the generated GenesisCode grammar acceptance constraint."
    },
    {
      "allowedTools": [
        "session-abort",
        "session-apply",
        "session-begin",
        "session-stage",
        "session-status",
        "session-test"
      ],
      "contentIdentitySha256": "e62356382bb2e4c1a9f85d8419dcdb040a24b21c0894a8e009e737698b35412f",
      "contrast": {
        "baselineId": null,
        "dimension": "reference-control"
      },
      "features": {
        "attempts": 1,
        "context": "retrieval-seed",
        "diagnostics": "structured-catalog-v0.1",
        "editing": "semantic-transaction-v0.1",
        "grammar": "gc-agent-v0.3-constraint",
        "repairs": 0,
        "retrieval": "integer-lexical-v0.1"
      },
      "id": "one-attempt",
      "ordinal": 7,
      "purpose": "Full fixed agent with all aids enabled and exactly one model response attempt."
    },
    {
      "allowedTools": [],
      "contentIdentitySha256": "0c9a0084e56ba83edabc914fff1ce609b5806ab30170b835e3499d2081365a37",
      "contrast": {
        "baselineId": "fixed-context",
        "dimension": "retrieval"
      },
      "features": {
        "attempts": 1,
        "context": "retrieval-seed",
        "diagnostics": "terminal-code-only",
        "editing": "artifact-response",
        "grammar": "production-acceptance-only",
        "repairs": 0,
        "retrieval": "integer-lexical-v0.1"
      },
      "id": "retrieval",
      "ordinal": 3,
      "purpose": "Fixed-context control replaced by deterministic task-conditioned integer retrieval."
    },
    {
      "allowedTools": [
        "session-abort",
        "session-apply",
        "session-begin",
        "session-stage",
        "session-status",
        "session-test"
      ],
      "contentIdentitySha256": "ced0c185fc9d89431524754dd9c00285668fbb9eb342809af19732a39097e722",
      "contrast": {
        "baselineId": "retrieval",
        "dimension": "editing"
      },
      "features": {
        "attempts": 1,
        "context": "retrieval-seed",
        "diagnostics": "terminal-code-only",
        "editing": "semantic-transaction-v0.1",
        "grammar": "production-acceptance-only",
        "repairs": 0,
        "retrieval": "integer-lexical-v0.1"
      },
      "id": "semantic-patch",
      "ordinal": 5,
      "purpose": "Retrieval control plus content-addressed semantic transaction editing only."
    }
  ],
  "analysis": {
    "comparisonPolicy": "predeclared-within-lineage-paired-contrasts",
    "conditionUnit": "conditionId",
    "crossLineagePooling": "cluster-or-hierarchical-only",
    "independentUnit": "lineageId",
    "repeatedConditionsIndependent": false,
    "requiredContrasts": [
      "bounded-repair-vs-one-attempt",
      "diagnostics-vs-retrieval",
      "fixed-context-vs-core-card-only",
      "grammar-constraint-vs-retrieval",
      "retrieval-vs-fixed-context",
      "semantic-patch-vs-retrieval"
    ]
  },
  "conditions": [
    {
      "ablationId": "bounded-repair",
      "ablationIdentitySha256": "8cf3bdaa691ccf29bf83e6016d3dd21cb2064b5b8be84e8c52a4afa8f7c46d9e",
      "contentIdentitySha256": "92b2cfe947dd271343c7004490a2e0b3ec9f835c300c8f0aa388171b3a577a35",
      "id": "condition-completion-001-bounded-repair",
      "lineageId": "lineage-completion-001",
      "lineageIdentitySha256": "6e1e39b15000664c02e50c6243e1cffbf6ff368270e914d74d9311501d94fd64",
      "oracleExposure": "same-as-lineage",
      "samplingUnit": "lineage-not-condition"
    },
    {
      "ablationId": "core-card-only",
      "ablationIdentitySha256": "e3a62167a35cc80e51b61249f4d6cd80e6b2b559b8cee784c3fa7e64b378308a",
      "contentIdentitySha256": "fcccf6e75bace18f420c801e2944a3caa20cffbc16dec993a4cdf2173ec44cd1",
      "id": "condition-completion-001-core-card-only",
      "lineageId": "lineage-completion-001",
      "lineageIdentitySha256": "6e1e39b15000664c02e50c6243e1cffbf6ff368270e914d74d9311501d94fd64",
      "oracleExposure": "same-as-lineage",
      "samplingUnit": "lineage-not-condition"
    },
    {
      "ablationId": "diagnostics",
      "ablationIdentitySha256": "f818a53de568310da607eeacb262d9319661684253b374936449974515d69af6",
      "contentIdentitySha256": "abf79979e003dab4dc41b90f3e0a870a42941073dd9ec57548ca7e84357f86cc",
      "id": "condition-completion-001-diagnostics",
      "lineageId": "lineage-completion-001",
      "lineageIdentitySha256": "6e1e39b15000664c02e50c6243e1cffbf6ff368270e914d74d9311501d94fd64",
      "oracleExposure": "same-as-lineage",
      "samplingUnit": "lineage-not-condition"
    },
    {
      "ablationId": "fixed-context",
      "ablationIdentitySha256": "33d1b9134421a5deacde16aaafe18ca9f7b1e0097c054beb38b6281709557d2b",
      "contentIdentitySha256": "9c9887fee96a786b6d15460b609fcb1183f39fa5e8e58f07011a66655c15cdca",
      "id": "condition-completion-001-fixed-context",
      "lineageId": "lineage-completion-001",
      "lineageIdentitySha256": "6e1e39b15000664c02e50c6243e1cffbf6ff368270e914d74d9311501d94fd64",
      "oracleExposure": "same-as-lineage",
      "samplingUnit": "lineage-not-condition"
    },
    {
      "ablationId": "grammar-constraint",
      "ablationIdentitySha256": "e1addced3909379e3f076fe0769d746af07e647e0a4ba83c7c7f6ffe176813e6",
      "contentIdentitySha256": "f070e43182fe1c389cb2ec6ba2dfd610e1efedaadac69d89b08c1686d9fad318",
      "id": "condition-completion-001-grammar-constraint",
      "lineageId": "lineage-completion-001",
      "lineageIdentitySha256": "6e1e39b15000664c02e50c6243e1cffbf6ff368270e914d74d9311501d94fd64",
      "oracleExposure": "same-as-lineage",
      "samplingUnit": "lineage-not-condition"
    },
    {
      "ablationId": "one-attempt",
      "ablationIdentitySha256": "e62356382bb2e4c1a9f85d8419dcdb040a24b21c0894a8e009e737698b35412f",
      "contentIdentitySha256": "4bd5970d38789a01b571bd82d21b897c35b1d7a3d2b9c7415010ebe27e9fcae9",
      "id": "condition-completion-001-one-attempt",
      "lineageId": "lineage-completion-001",
      "lineageIdentitySha256": "6e1e39b15000664c02e50c6243e1cffbf6ff368270e914d74d9311501d94fd64",
      "oracleExposure": "same-as-lineage",
      "samplingUnit": "lineage-not-condition"
    },
    {
      "ablationId": "retrieval",
      "ablationIdentitySha256": "0c9a0084e56ba83edabc914fff1ce609b5806ab30170b835e3499d2081365a37",
      "contentIdentitySha256": "0ad57be1b4dab7c9bcd26c3ef338dac5f74c482ee9a64ea9c19b380b0532b316",
      "id": "condition-completion-001-retrieval",
      "lineageId": "lineage-completion-001",